{
  "id": "p5b77XokaY0iGUtOAgqZF",
  "url": "https://youtube.com",
  "geoScore": 30,
  "pillars": [
    {
      "name": "Answer Readiness",
      "score": 0,
      "max": 25
    },
    {
      "name": "Schema & Structured Data",
      "score": 0,
      "max": 20
    },
    {
      "name": "Rendering & Indexability",
      "score": 17,
      "max": 20
    },
    {
      "name": "Evidence Packaging",
      "score": 9,
      "max": 15
    },
    {
      "name": "Entity Clarity",
      "score": 2,
      "max": 10
    },
    {
      "name": "Freshness",
      "score": 2,
      "max": 10
    }
  ],
  "findings": [
    {
      "id": "faq_missing",
      "severity": "high",
      "fixTitle": "Add visible FAQ with matching JSON-LD",
      "impact": "high",
      "effort": "low",
      "where": "After the section that introduces the product's workflow.",
      "why": "No FAQ/Q&A headings detected, so the page cannot answer common queries directly.",
      "snippetHtml": "<section aria-labelledby=\"faq-title\" class=\"space-y-4\">\n  <h2 id=\"faq-title\" class=\"text-2xl font-semibold\">Frequently Asked Questions</h2>\n  \n  <p class=\"text-sm text-muted-foreground\">Generated from https://youtube.com on November 7, 2025.</p>\n</section>",
      "snippetJsonld": "{\n  \"@context\": \"https://schema.org\",\n  \"@type\": \"FAQPage\",\n  \"mainEntity\": [],\n  \"mainEntityOfPage\": \"https://youtube.com\"\n}"
    },
    {
      "id": "tldr_missing",
      "severity": "medium",
      "fixTitle": "Add TL;DR summary near the hero",
      "impact": "medium",
      "effort": "low",
      "where": "Immediately after the hero paragraph.",
      "why": "No TL;DR or key takeaway statements were found within the first screenful.",
      "snippetHtml": "<section class=\"rounded-lg border border-amber-200 bg-amber-50 p-4\">\n  <p class=\"text-sm font-semibold tracking-wide text-amber-900\">TL;DR</p>\n  <p class=\"text-base text-amber-900/90\">\n    {Replace with a 2-sentence summary that states the claim and the measurable outcome customers care about.}\n  </p>\n</section>"
    },
    {
      "id": "claim_evidence_gap",
      "severity": "high",
      "fixTitle": "Pair each claim with inline evidence",
      "impact": "high",
      "effort": "medium",
      "where": "Within the first two body sections.",
      "why": "Paragraphs mention benefits without citing primary sources or data.",
      "snippetHtml": "<p>\n  <strong>Claim:</strong> Teams that ship weekly GEO audits improve answer surfaces within 2 sprints.\n  <strong>Evidence:</strong> According to <a href=\"https://example.com/report-2025\" target=\"_blank\" rel=\"noopener\">Forrester, 2025</a>,\n  programs with structured audits saw a 31% lift in AI-ready snippets.\n</p>"
    },
    {
      "id": "claim_no_citation",
      "severity": "high",
      "fixTitle": "Add citations next to bold claims",
      "impact": "high",
      "effort": "medium",
      "where": "Wherever metrics or rankings are listed.",
      "why": "Claims are not followed by outbound, primary-source links.",
      "snippetHtml": "<p>\n  <strong>Claim:</strong> YouTube reduces hallucinated answers by 48%.\n  <strong>Evidence:</strong> According to <a href=\"https://data.youtube.com/geo-study.csv\" target=\"_blank\" rel=\"noopener\">Internal Study, 2025</a>\n  across 120 intents.\n</p>"
    },
    {
      "id": "jsonld_missing",
      "severity": "high",
      "fixTitle": "Add Article schema describing the page",
      "impact": "high",
      "effort": "low",
      "where": "<head>",
      "why": "No JSON-LD blocks were detected.",
      "snippetJsonld": "{\n  \"@context\": \"https://schema.org\",\n  \"@type\": \"Article\",\n  \"headline\": \"YouTube\",\n  \"author\": {\n    \"@type\": \"Organization\",\n    \"name\": \"youtube.com\"\n  },\n  \"datePublished\": \"2025-11-08\",\n  \"dateModified\": \"2025-11-08\",\n  \"mainEntityOfPage\": \"https://youtube.com\",\n  \"publisher\": {\n    \"@type\": \"Organization\",\n    \"name\": \"youtube.com\"\n  }\n}"
    },
    {
      "id": "schema_properties_sparse",
      "severity": "medium",
      "fixTitle": "Expand schema with author, dates, publisher, and mainEntity",
      "impact": "medium",
      "effort": "low",
      "where": "<head>",
      "why": "Schema is missing author/publisher/date properties required for rich results.",
      "snippetJsonld": "{\n  \"@context\": \"https://schema.org\",\n  \"@type\": \"Article\",\n  \"headline\": \"YouTube\",\n  \"author\": {\n    \"@type\": \"Person\",\n    \"name\": \"Please add editor name\"\n  },\n  \"datePublished\": \"2025-11-08\",\n  \"dateModified\": \"2025-11-08\",\n  \"publisher\": {\n    \"@type\": \"Organization\",\n    \"name\": \"youtube.com\",\n    \"logo\": {\n      \"@type\": \"ImageObject\",\n      \"url\": \"https://youtube.com/logo.png\"\n    }\n  },\n  \"mainEntityOfPage\": \"https://youtube.com\"\n}"
    },
    {
      "id": "canonical_conflict",
      "severity": "medium",
      "fixTitle": "Set a canonical that matches the live URL",
      "impact": "medium",
      "effort": "low",
      "where": "<head>",
      "why": "The canonical link points to a different host or is missing.",
      "snippetHtml": "<link rel=\"canonical\" href=\"https://youtube.com\" />"
    },
    {
      "id": "inline_dates_missing",
      "severity": "medium",
      "fixTitle": "Add inline updated-on dates",
      "impact": "medium",
      "effort": "low",
      "where": "Under the heading or within stat blocks.",
      "why": "No inline dates were found near key claims.",
      "snippetHtml": "<p>\n  <time datetime=\"2025-11-08\">Updated on November 7, 2025</time> â€“ GEO benchmarks refreshed monthly.\n</p>"
    },
    {
      "id": "table_missing",
      "severity": "medium",
      "fixTitle": "Publish structured table with downloadable CSV",
      "impact": "medium",
      "effort": "medium",
      "where": "After the methodology section.",
      "why": "No tables or data downloads detected despite metrics being referenced.",
      "snippetHtml": "<table class=\"w-full text-sm\">\n  <caption>Weekly GEO score impact</caption>\n  <thead>\n    <tr><th>Week</th><th>Score</th><th>Primary Fix</th></tr>\n  </thead>\n  <tbody>\n    <tr><td>1</td><td>42</td><td>Added TL;DR</td></tr>\n    <tr><td>4</td><td>78</td><td>Shipped FAQ schema</td></tr>\n  </tbody>\n</table>",
      "snippetJsonld": "{\n  \"@context\": \"https://schema.org\",\n  \"@type\": \"Dataset\",\n  \"name\": \"Weekly GEO score impact\",\n  \"description\": \"Key figures from YouTube.\",\n  \"distribution\": [\n    {\n      \"@type\": \"DataDownload\",\n      \"encodingFormat\": \"text/csv\",\n      \"contentUrl\": \"https://youtube.com/downloads/geo-score.csv\"\n    }\n  ]\n}"
    },
    {
      "id": "entity_schema_missing",
      "severity": "medium",
      "fixTitle": "Declare Organization and Person entities",
      "impact": "medium",
      "effort": "low",
      "where": "<head>",
      "why": "Schema lacks Organization/WebSite + Person/Product definitions.",
      "snippetJsonld": "{\n  \"@context\": \"https://schema.org\",\n  \"@type\": \"Organization\",\n  \"name\": \"youtube.com\",\n  \"url\": \"https://youtube.com\",\n  \"logo\": \"https://youtube.com/logo.png\",\n  \"sameAs\": [\n    \"https://www.linkedin.com/company/youtube.com\",\n    \"https://twitter.com/youtube.com\"\n  ]\n}"
    },
    {
      "id": "name_inconsistent",
      "severity": "low",
      "fixTitle": "Align H1, title, and schema names",
      "impact": "low",
      "effort": "low",
      "where": "Hero heading and metadata.",
      "why": "The H1 text does not match the <title> and schema headline.",
      "snippetHtml": "<h1>YouTube</h1>\n<meta name=\"og:title\" content=\"YouTube\" />"
    },
    {
      "id": "sameas_missing",
      "severity": "low",
      "fixTitle": "Add sameAs references",
      "impact": "low",
      "effort": "low",
      "where": "Organization JSON-LD block.",
      "why": "Organization schema is missing sameAs links to public profiles.",
      "snippetJsonld": "{\n  \"@context\": \"https://schema.org\",\n  \"@type\": \"Organization\",\n  \"name\": \"youtube.com\",\n  \"url\": \"https://youtube.com\",\n  \"sameAs\": [\n    \"https://en.wikipedia.org/wiki/youtube.com\",\n    \"https://www.crunchbase.com/organization/youtube.com\"\n  ]\n}"
    },
    {
      "id": "updated_on_missing",
      "severity": "medium",
      "fixTitle": "Display Updated on near the title",
      "impact": "medium",
      "effort": "low",
      "where": "Immediately below the H1.",
      "why": "No visible updated timestamp was found near the hero.",
      "snippetHtml": "<p class=\"text-sm text-muted-foreground\">\n  <time datetime=\"2025-11-08\">Updated on November 7, 2025</time>\n</p>"
    },
    {
      "id": "sitemap_stale",
      "severity": "medium",
      "fixTitle": "Refresh sitemap <lastmod> within 365 days",
      "impact": "medium",
      "effort": "low",
      "where": "build pipeline that writes sitemap.xml",
      "why": "Sitemap lastmod is older than one year.",
      "snippetJs": "import { writeFileSync } from 'node:fs';\n\nconst lastmod = new Date().toISOString().split(\"T\")[0];\nconst urls = [\n  { loc: 'https://youtube.com', lastmod }\n];\n\nconst xmlBody = urls\n  .map(url => `<url><loc>${url.loc}</loc><lastmod>${url.lastmod}</lastmod></url>`)\n  .join('');\nconst xml = [\n  '<?xml version=\"1.0\" encoding=\"UTF-8\"?>',\n  '<urlset xmlns=\"http://www.sitemaps.org/schemas/sitemap/0.9\">',\n  xmlBody,\n  '</urlset>'\n].join('\\n');\n\nwriteFileSync('public/sitemap.xml', xml);"
    },
    {
      "id": "changelog_missing",
      "severity": "low",
      "fixTitle": "Link to release notes or changelog",
      "impact": "low",
      "effort": "medium",
      "where": "Footer or FAQ section.",
      "why": "No changelog links or version history references were detected.",